{
  "$schema": "../schemas/artwork.schema.json",
  "title": {
    "de": "Wirbelsäule mit Becken",
    "en": "Spine and Pelvis"
  },
  "year": 2019,
  "month": 8,
  "size": "100 × 70 cm",
  "materials": "pastel_ink",
  "availability": "available",
  "image": "../../assets/artworks/wirbelsaeule-mit-becken.jpg",
  "featured": false,
  "tags": ["anatomy"]
}
