{
  "$schema": "../schemas/artwork.schema.json",
  "title": {
    "de": "Eva mit Rosen",
    "en": "Eve with Roses"
  },
  "year": 2022,
  "month": 3,
  "size": "120 × 90 cm",
  "materials": "oil_canvas",
  "availability": "available",
  "image": "../../assets/artworks/eva-mit-rosen.jpg",
  "featured": false,
  "tags": ["nude"]
}
