{
  "$schema": "../schemas/artwork.schema.json",
  "title": {
    "de": "Sitzende Frau, von hinten",
    "en": "Seated Woman, from Behind"
  },
  "year": 2023,
  "month": 1,
  "size": "A3",
  "materials": "pencil",
  "availability": "available",
  "image": "../../assets/artworks/sitzende-frau-von-hinten.jpg",
  "featured": false,
  "tags": ["nude", "sketch"]
}
