{
  "$schema": "../schemas/artwork.schema.json",
  "title": {
    "de": "Riffelsee ob Zermatt",
    "en": "Riffelsee above Zermatt"
  },
  "year": 2017,
  "month": 9,
  "size": "80 × 100 cm",
  "materials": "acrylic_canvas",
  "availability": "not_available",
  "image": "../../assets/artworks/riffelsee-ob-zermatt.jpg",
  "featured": true,
  "tags": ["nature"]
}
