{
  "$schema": "../schemas/artwork.schema.json",
  "title": {
    "de": "Mann mit Schnauz",
    "en": "Man with Moustache"
  },
  "year": 2019,
  "month": 9,
  "notes": {
    "de": "Auftragswerk",
    "en": "Commissioned work"
  },
  "size": "60 × 50 cm",
  "materials": "oil_canvas",
  "availability": "not_available",
  "image": "../../assets/artworks/mann-mit-schnauz.jpg",
  "featured": false,
  "tags": ["portrait"]
}
