{
  "$schema": "../schemas/artwork.schema.json",
  "title": {
    "de": "Weisshorn",
    "en": "Weisshorn"
  },
  "year": 2017,
  "month": 2,
  "size": "100 × 140 cm",
  "materials": "pastel_photo",
  "availability": "available",
  "image": "../../assets/artworks/weisshorn.jpg",
  "featured": false,
  "tags": ["nature"]
}
