{
  "$schema": "../schemas/artwork.schema.json",
  "title": {
    "de": "Iris mit Kopf auf Hand",
    "en": "Iris with Head on Hand"
  },
  "size": "A5",
  "materials": "pencil_notebook",
  "availability": "not_available",
  "image": "../../assets/artworks/laechelnde-frau-kopf-auf-der-hand.jpg",
  "featured": false,
  "tags": ["portrait", "sketch"]
}
