{
  "$schema": "../schemas/artwork.schema.json",
  "title": {
    "de": "Selbstportrait",
    "en": "Self-Portrait"
  },
  "size": "100 × 80 cm",
  "materials": "acrylic_canvas",
  "availability": "not_available",
  "image": "../../assets/artworks/selbstportrait.jpg",
  "featured": false,
  "tags": ["portrait"]
}
