{
  "$schema": "../schemas/artwork.schema.json",
  "title": {
    "de": "Leopard und Maus mit Pinsel",
    "en": "Leopard and Mouse with Brush"
  },
  "year": 2018,
  "month": 8,
  "size": "80 × 100 cm",
  "materials": "acrylic_canvas",
  "availability": "not_available",
  "image": "../../assets/artworks/leopard-und-maus-mit-pinsel.jpg",
  "featured": false,
  "tags": ["animals"]
}
