{
  "$schema": "../schemas/artwork.schema.json",
  "title": {
    "de": "Stehende Frau",
    "en": "Standing Woman"
  },
  "year": 2022,
  "month": 2,
  "size": "70 × 50 cm",
  "materials": "pastel_photo",
  "availability": "available",
  "image": "../../assets/artworks/stehende-frau.jpg",
  "featured": false,
  "tags": ["nude"]
}
