{
  "$schema": "../schemas/artwork.schema.json",
  "title": {
    "de": "Junge Sängerin",
    "en": "Young Singer"
  },
  "year": 2022,
  "month": 10,
  "size": "A5",
  "materials": "pastel_chalk_notebook",
  "availability": "available",
  "image": "../../assets/artworks/junge-saengerin.jpg",
  "featured": false,
  "tags": ["portrait"]
}
