{
  "$schema": "../schemas/artwork.schema.json",
  "title": {
    "de": "Eisvogel",
    "en": "Kingfisher"
  },
  "year": 2022,
  "month": 6,
  "size": "70 × 50 cm",
  "materials": "pastel_photo",
  "availability": "available",
  "image": "../../assets/artworks/eisvogel.jpg",
  "featured": false,
  "tags": ["animals"]
}
