{
  "$schema": "../schemas/artwork.schema.json",
  "title": {
    "de": "Hausfassade in Lugano",
    "en": "Facade in Lugano"
  },
  "year": 2021,
  "month": 6,
  "size": "A5",
  "materials": "pencil_notebook",
  "availability": "available",
  "image": "../../assets/artworks/hausfassade-lugano.jpg",
  "featured": false,
  "tags": ["sketch"]
}
